title,authors,summary,published,link,keyword_used
"Radious: Unveiling the Enigma of Dental Radiology with BEIT Adaptor and
  Mask2Former in Semantic Segmentation","Mohammad Mashayekhi, Sara Ahmadi Majd, Arian Amiramjadi, Babak Mashayekhi","X-ray images are the first steps for diagnosing and further treating dental
problems. So, early diagnosis prevents the development and increase of oral and
dental diseases. In this paper, we developed a semantic segmentation algorithm
based on BEIT adaptor and Mask2Former to detect and identify teeth, roots, and
multiple dental diseases and abnormalities such as pulp chamber, restoration,
endodontics, crown, decay, pin, composite, bridge, pulpitis, orthodontics,
radicular cyst, periapical cyst, cyst, implant, and bone graft material in
panoramic, periapical, and bitewing X-ray images. We compared the result of our
algorithm to two state-of-the-art algorithms in image segmentation named:
Deeplabv3 and Segformer on our own data set. We discovered that Radious
outperformed those algorithms by increasing the mIoU scores by 9% and 33% in
Deeplabv3+ and Segformer, respectively.",2023-05-10T15:15:09Z,http://arxiv.org/abs/2305.06236v1,dental implant
"DentiBot: System Design and 6-DoF Hybrid Position/Force Control for
  Robot-Assisted Endodontic Treatment","Hao-Fang Cheng, Yi-Ching Ho, Cheng-Wei Chen","Robotic technologies are becoming increasingly popular in dentistry due to
the high level of precision required in delicate dental procedures. Most dental
robots available today are designed for implant surgery, helping dentists to
accurately place implants in the desired position and depth. In this paper, we
introduce the DentiBot, the first robot specifically designed for dental
endodontic treatment. The DentiBot is equipped with a force and torque sensor,
as well as a string-based Patient Tracking Module, allowing for real-time
monitoring of endodontic file contact and patient movement. We propose a 6-DoF
hybrid position/force controller that enables autonomous adjustment of the
surgical path and compensation for patient movement, while also providing
protection against endodontic file fracture. In addition, a file flexibility
model is incorporated to compensate for file bending. Pre-clinical evaluations
performed on acrylic root canal models and resin teeth confirm the feasibility
of the DentiBot in assisting endodontic treatment.",2023-10-15T01:04:50Z,http://arxiv.org/abs/2310.09691v1,dental implant
"Oral-3D: Reconstructing the 3D Bone Structure of Oral Cavity from 2D
  Panoramic X-ray","Weinan Song, Yuan Liang, Jiawei Yang, Kun Wang, Lei He","Panoramic X-ray (PX) provides a 2D picture of the patient's mouth in a
panoramic view to help dentists observe the invisible disease inside the gum.
However, it provides limited 2D information compared with cone-beam computed
tomography (CBCT), another dental imaging method that generates a 3D picture of
the oral cavity but with more radiation dose and a higher price. Consequently,
it is of great interest to reconstruct the 3D structure from a 2D X-ray image,
which can greatly explore the application of X-ray imaging in dental surgeries.
In this paper, we propose a framework, named Oral-3D, to reconstruct the 3D
oral cavity from a single PX image and prior information of the dental arch.
Specifically, we first train a generative model to learn the cross-dimension
transformation from 2D to 3D. Then we restore the shape of the oral cavity with
a deformation module with the dental arch curve, which can be obtained simply
by taking a photo of the patient's mouth. To be noted, Oral-3D can restore both
the density of bony tissues and the curved mandible surface. Experimental
results show that Oral-3D can efficiently and effectively reconstruct the 3D
oral structure and show critical information in clinical applications, e.g.,
tooth pulling and dental implants. To the best of our knowledge, we are the
first to explore this domain transformation problem between these two imaging
methods.",2020-03-18T18:02:57Z,http://arxiv.org/abs/2003.08413v4,dental implant
"A two-stage approach for beam hardening artifact reduction in low-dose
  dental CBCT","T. Bayaraa, C. M. Hyun, T. J. Jang, S. M. Lee, J. K. Seo","This paper presents a two-stage method for beam hardening artifact correction
of dental cone beam computerized tomography (CBCT). The proposed artifact
reduction method is designed to improve the quality of maxillofacial imaging,
where soft tissue details are not required. Compared to standard CT, the
additional difficulty of dental CBCT comes from the problems caused by offset
detector, FOV truncation, and low signal-to-noise ratio due to low X-ray
irradiation. To address these problems, the proposed method primarily performs
a sinogram adjustment in the direction of enhancing data consistency,
considering the situation according to the FOV truncation and offset detector.
This sinogram correction algorithm significantly reduces beam hardening
artifacts caused by high-density materials such as teeth, bones, and metal
implants, while tending to amplify special types of noise. To suppress such
noise, a deep convolutional neural network is complementarily used, where CT
images adjusted by the sinogram correction are used as the input of the neural
network. Numerous experiments validate that the proposed method successfully
reduces beam hardening artifacts and, in particular, has the advantage of
improving the image quality of teeth, associated with maxillofacial CBCT
imaging.",2020-10-08T05:48:31Z,http://arxiv.org/abs/2010.03778v1,dental implant
"Neural Representation-Based Method for Metal-induced Artifact Reduction
  in Dental CBCT Imaging","Hyoung Suk Park, Kiwan Jeon, Jin Keun Seo","This study introduces a novel reconstruction method for dental cone-beam
computed tomography (CBCT), focusing on effectively reducing metal-induced
artifacts commonly encountered in the presence of prevalent metallic implants.
Despite significant progress in metal artifact reduction techniques, challenges
persist owing to the intricate physical interactions between polychromatic
X-ray beams and metal objects, which are further compounded by the additional
effects associated with metal-tooth interactions and factors specific to the
dental CBCT data environment. To overcome these limitations, we propose an
implicit neural network that generates two distinct and informative tomographic
images. One image represents the monochromatic attenuation distribution at a
specific energy level, whereas the other captures the nonlinear beam-hardening
factor resulting from the polychromatic nature of X-ray beams. In contrast to
existing CT reconstruction techniques, the proposed method relies exclusively
on the Beer--Lambert law, effectively preventing the generation of
metal-induced artifacts during the backprojection process commonly implemented
in conventional methods. Extensive experimental evaluations demonstrate that
the proposed method effectively reduces metal artifacts while providing
high-quality image reconstructions, thus emphasizing the significance of the
second image in capturing the nonlinear beam-hardening factor.",2023-07-27T01:57:06Z,http://arxiv.org/abs/2307.14579v1,dental implant
"MARformer: An Efficient Metal Artifact Reduction Transformer for Dental
  CBCT Images","Yuxuan Shi, Jun Xu, Dinggang Shen","Cone Beam Computed Tomography (CBCT) plays a key role in dental diagnosis and
surgery. However, the metal teeth implants could bring annoying metal artifacts
during the CBCT imaging process, interfering diagnosis and downstream
processing such as tooth segmentation. In this paper, we develop an efficient
Transformer to perform metal artifacts reduction (MAR) from dental CBCT images.
The proposed MAR Transformer (MARformer) reduces computation complexity in the
multihead self-attention by a new Dimension-Reduced Self-Attention (DRSA)
module, based on that the CBCT images have globally similar structure. A
Patch-wise Perceptive Feed Forward Network (P2FFN) is also proposed to perceive
local image information for fine-grained restoration. Experimental results on
CBCT images with synthetic and real-world metal artifacts show that our
MARformer is efficient and outperforms previous MAR methods and two restoration
Transformers.",2023-11-16T06:02:03Z,http://arxiv.org/abs/2311.09590v2,dental implant
"Assessing the Dosimetric Effects of High-Z Titanium Implants in Proton
  Therapy Using Pixel Detectors","C. Balan, C. Granja, G. Mytsin, S. Shvidky, A. Molokanov, V. Chis, C. Oancea","This study experimentally examines the effect and changes in the delivered
fields, using water-equivalent phantoms with and without titanium (Ti) dental
implants positioned along the primary beam path. We measure in detail the
composition and spectral-tracking characterization of particles generated in
the entrance region of the Bragg curve using high-spatial resolution, spectral
and time-sensitive imaging detectors with a pixelated array provided by the
ASIC chip Timepix3. A 170 MeV proton beam was collimated and modulated in a
polymethyl methacrylate (PMMA). Placing two dental implants at the end of the
protons range in the phantom, the radiation was measured using two pixeled
detectors with Si sensors. The Timepix3 (TPX3) detectors equipped with silicon
sensors measure in detail particle fluxes, dose rates (DR) and linear energy
transfer (LET) spectra for resolved particle types. Artificial intelligence
(AI) based-trained neural networks (NN) calibrated in well-defined radiation
fields were used to analyze and identify particles based on morphology and
characteristic spectral-tracking response. The beam was characterized and
single-particle tracks were registered and decomposed into particle-type
groups. The resulting particle fluxes in both setups are resolved into three
main classes of particles: i) protons, ii) electrons and photons iii) ions.
Protons are the main particle component responsible for dose deposition.
High-energy transfer particles (HETP), namely ions exhibited differences in
both dosimetric aspects that were investigated: DR and particle fluxes, when
the Ti implants were placed in the setup. The detailed multi-parametric
information of the secondary radiation field provides a comprehensive
understanding of the impact of Ti materials in proton therapy.",2024-09-27T07:57:14Z,http://arxiv.org/abs/2409.18521v1,dental implant
"Particle Tracking, Recognition and LET Evaluation of Out-of-Field Proton
  Therapy Delivered to a Phantom with Implants","Cristina Balan, Carlos Granja, Gennady Mytsin, Sergey Shvidky, Alexander Molokanov, Lukas Marek, Vasile Chis, Cristina Oancea","This study aims to assess the composition of scattered particles generated in
proton therapy for tumours situated proximal to titanium dental implants. The
investigation involves decomposing the mixed field and recording Linear Energy
Transfer (LET) spectra to quantify the influence of metallic dental inserts
located behind the tumour. A conformal proton beam was used to deliver the
treatment plan to an anthropomorphic head phantom with two types of implants
(Ti and plastic) inserted in the target volume. The stray radiation resulting
during the irradiation was detected by a hybrid semiconductor pixel detector
MiniPIX Timepix3 that was placed distal to the Spread-out Bragg peak.
Visualization and field decomposition of stray radiation were generated using
algorithms trained in particle recognition based on artificial intelligence
convolution neural networks (AI CNN). Spectral sensitive aspects of the
scattered radiation were collected using two angular positions of the detector
relative to the beam direction: 0 and 60{\deg}. Using AI CNN, 3 classes of
particles were identified: protons, electrons & photons, ions & fast neutrons.
Placing a Ti implant in the beam's path resulted in predominantly electrons and
photons, contributing 52.2%, whereas for plastic implants, the contribution was
65.4%. Scattered protons comprised 45.5% and 31.9% with and without Ti inserts,
respectively. The LET spectra was derived for each group of particles, with
values ranging from 0.01 to 7.5 keV{\mu}m-1 for Ti/plastic implants. The
low-LET component was primarily composed of electrons and photons, while the
high-LET component corresponded to protons and ions. This method, complemented
by directional maps, holds potential for evaluating and validating treatment
plans involving stray radiation near organs at risk, offering precise
discrimination of the mixt field, enhancing in this way the LET calculation.",2023-12-21T21:30:43Z,http://arxiv.org/abs/2312.14304v1,dental implant
"Tribocorrosion under galvanic interaction of Ti6Al4V and NiCr implant
  alloys","Camila Dias dos Reis Barros, Janaina Cardozo Rocha, Ivan Napoleão Bastos, José Antônio da Cunha Ponciano Gomes","Micromovements that occur in the joint between dental prostheses and implants
can lead to wear-induced degradation. This process can be enhanced by corrosion
in the oral environment influenced by the presence of solutions containing
fluoride. Moreover, the eventual galvanic interactions between NiCr and Ti
alloys can accelerate the wear-corrosion process. In this work, the
tribocorrosion process of Ti6Al4V and NiCr alloys used in dental implant
rehabilitations immersed in fluoride solutions at different pH values was
investigated. The galvanic interaction effect between the alloys was also
assessed. Tribocorrosion tests in corrosive media were performed with isolated
Ti6Al4V and NiCr alloys, followed by testing with both alloys in contact. The
media selected were based on fluoride concentrations and pH values that are
possible to be found in oral environments. Analysis of the surfaces after the
tribocorrosion tests was carried out using confocal laser microscopy. The wear
profile and volume losses were determined by confocal measurements. It was
concluded that the galvanic interaction between the alloys increased the
tribocorrosion resistance of Ti6Al4V, compared with that of the isolated
Ti6Al4V alloy. Ti6Al4V coupled with NiCr reduced the electrochemical potential
decay during sliding. The increased resistance was explained by the
electrochemical shift of the Ti6Al4V potential from active dissolution to the
passive domain.",2020-05-30T13:42:46Z,http://arxiv.org/abs/2006.00270v1,dental implant
"Femtosecond laser upscaling strategy and biological validation for
  dental screws with improved osteogenic performance","Mathieu Maalouf, Yoan Di Maio, David Pallarés-Aldeiturriaga, Xxx Sedao, Lauriane Hivert, Steve Papa, Elisa Dalix, Mireille Thomas, Alain Guignandon, Virginie Dumas","Osseointegration is one of the key conditions for long term successful dental
implantation. To this end, titanium alloys undergo plethora of surface
treatments able to sustain osteogenic differentiation. For these surface
treatments, femtosecond laser (FSL) can generate precise and reproducible
surface patterns on titanium, avoiding thermal damage and chemical pollution.
We recently identify that laser-induced periodic surface structure (LIPSS) with
radial orientation, generated on model (flat) titanium surface, has a high
osteogenic potential. However, nano-texturing is time consuming. In the present
study, we aimed to reduce the texturing time of radial LIPSS, as well as
processing of large commercially available dental screws by ways of laser beam
engineering. Our objectives were to maintain at least osteogenic properties
demonstrated on model surfaces by adjusting laser beam diameters and to
demonstrate maintenance of performance with a dental screw texturing process
not exceeding 1 minute.We first textured model surfaces with radial LIPSS by
laser beams of different diameters, with surface impacts of 24$\mu$m, 80$\mu$m
or 180$\mu$m, named as R24, R80 or R180 respectively. Osteogenic performance of
human mesenchymal stem cells (hMSCs) were compared; seeded on polished control
surfaces and textured surfaces and subjected to osteogenic evaluation by
cell/matrix imaging, qRT-PCR and mineral deposition quantification. All
textured surfaces showed greater osteogenic potential than the control
surfaces, with significantly higher efficacy on R180 surface. Therefore, R180
pattern with large beam impacts was chosen for texturing on a dental screw and
its osteogenic activity was compared to that of a non-textured screw.
Interestingly, R180 required only 40 seconds to be textured on whole screws, on
which it preserved a high osteogenic potential. Thus, by using FSL technology,
we have improved the osteogenic potential of a topographic pattern while
optimizing and scaling up its processing time on a medical device.",2024-06-17T13:23:47Z,http://arxiv.org/abs/2406.11521v1,dental implant
Panorama Tomosynthesis from Head CBCT with Simulated Projection Geometry,"Anusree P. S., Bikram Keshari Parida, Seong Yong Moon, Wonsang You","Cone Beam Computed Tomography (CBCT) and Panoramic X-rays are the most
commonly used imaging modalities in dental health care. CBCT can produce
three-dimensional views of a patient's head, providing clinicians with better
diagnostic capability, whereas Panoramic X-ray can capture the entire
maxillofacial region in a single image. If the CBCT is already available, it
can be beneficial to synthesize a Panoramic X-ray, thereby avoiding an
immediate additional scan and extra radiation exposure. Existing methods focus
on delineating an approximate dental arch and creating orthogonal projections
along this arch. However, no golden standard is available for such dental arch
extractions, and this choice can affect the quality of synthesized X-rays. To
avoid such issues, we propose a novel method for synthesizing Panoramic X-rays
from diverse head CBCTs, employing a simulated projection geometry and dynamic
rotation centers. Our method effectively synthesized panoramic views from CBCT,
even for patients with missing or nonexistent teeth and in the presence of
severe metal implants. Our results demonstrate that this method can generate
high-quality panoramic images irrespective of the CBCT scanner geometry.",2024-08-18T04:48:03Z,http://arxiv.org/abs/2408.09358v2,dental implant
"A Deep Learning Approach to Teeth Segmentation and Orientation from
  Panoramic X-rays","Mrinal Kanti Dhar, Mou Deb, D. Madhab, Zeyun Yu","Accurate teeth segmentation and orientation are fundamental in modern oral
healthcare, enabling precise diagnosis, treatment planning, and dental implant
design. In this study, we present a comprehensive approach to teeth
segmentation and orientation from panoramic X-ray images, leveraging deep
learning techniques. We build our model based on FUSegNet, a popular model
originally developed for wound segmentation, and introduce modifications by
incorporating grid-based attention gates into the skip connections. We
introduce oriented bounding box (OBB) generation through principal component
analysis (PCA) for precise tooth orientation estimation. Evaluating our
approach on the publicly available DNS dataset, comprising 543 panoramic X-ray
images, we achieve the highest Intersection-over-Union (IoU) score of 82.43%
and Dice Similarity Coefficient (DSC) score of 90.37% among compared models in
teeth instance segmentation. In OBB analysis, we obtain the Rotated IoU (RIoU)
score of 82.82%. We also conduct detailed analyses of individual tooth labels
and categorical performance, shedding light on strengths and weaknesses. The
proposed model's accuracy and versatility offer promising prospects for
improving dental diagnoses, treatment planning, and personalized healthcare in
the oral domain. Our generated OBB coordinates and codes are available at
https://github.com/mrinal054/Instance_teeth_segmentation.",2023-10-26T06:01:25Z,http://arxiv.org/abs/2310.17176v1,dental implant
"Gestalt driven augmented collimator widget for precise 5 dof dental
  drill tool positioning in 3d space","Mine Dastan, Antonio E. Uva, Michele Fiorentino","Drill tool positioning in dental implantology is a challenging task requiring
5DOF precision as the rotation around the tool axis is not influential. This
work improves the quasi-static visual elements of the state-of-the-art with a
novel Augmented Collimation Widget (ACW), an interactive tool of position and
angle error visualization based on the gestalt reification, the human ability
to group geometric elements. The user can seek in a quick, pre-attentive way
the collimation of five (three positional and two rotational) error component
widgets (ECWs), taking advantage of three key aspects: component separation and
reification, error visual amplification, and dynamic hiding of the collimated
components. We compared the ACW with the golden standard in a within-subjects
(N=30) user test using 32 implant targets, measuring the time, error, and
usability. ACW performed significantly better in positional (+19%) and angular
(+47%) precision accuracy and with less mental demand (-6%) and frustration
(-13%), but with an expected increase in task time (+59%) and physical demand
(+64%). The interview indicated the ACW as the main preference and
aesthetically more pleasant than GSW, candidating it as the new golden standard
for implantology, but also for other applications where 5DOF positioning is
key.",2024-09-17T07:56:54Z,http://arxiv.org/abs/2409.10960v1,dental implant
MI image registration using prior knowledge,"W. Jacquet, P. de Groen","Subtraction of aligned images is a means to assess changes in a wide variety
of clinical applications. In this paper we explore the information theoretical
origin of Mutual Information (MI), which is based on Shannon's entropy.However,
the interpretation of standard MI registration as a communication channel
suggests that MI is too restrictive a criterion. In this paper the concept of
Mutual Information (MI) is extended to (Normalized) Focussed Mutual Information
(FMI) to incorporate prior knowledge to overcome some shortcomings of MI. We
use this to develop new methodologies to successfully address specific
registration problems, the follow-up of dental restorations, cephalometry, and
the monitoring of implants.",2007-05-24T14:41:11Z,http://arxiv.org/abs/0705.3593v2,dental implant
"Metal Artifact Reduction with Intra-Oral Scan Data for 3D Low Dose
  Maxillofacial CBCT Modeling","Chang Min Hyun, Taigyntuya Bayaraa, Hye Sun Yun, Tae Jun Jang, Hyoung Suk Park, Jin Keun Seo","Low-dose dental cone beam computed tomography (CBCT) has been increasingly
used for maxillofacial modeling. However, the presence of metallic inserts,
such as implants, crowns, and dental filling, causes severe streaking and
shading artifacts in a CBCT image and loss of the morphological structures of
the teeth, which consequently prevents accurate segmentation of bones. A
two-stage metal artifact reduction method is proposed for accurate 3D low-dose
maxillofacial CBCT modeling, where a key idea is to utilize explicit tooth
shape prior information from intra-oral scan data whose acquisition does not
require any extra radiation exposure. In the first stage, an image-to-image
deep learning network is employed to mitigate metal-related artifacts. To
improve the learning ability, the proposed network is designed to take
advantage of the intra-oral scan data as side-inputs and perform multi-task
learning of auxiliary tooth segmentation. In the second stage, a 3D
maxillofacial model is constructed by segmenting the bones from the dental CBCT
image corrected in the first stage. For accurate bone segmentation, weighted
thresholding is applied, wherein the weighting region is determined depending
on the geometry of the intra-oral scan data. Because acquiring a paired
training dataset of metal-artifact-free and metal artifact-affected dental CBCT
images is challenging in clinical practice, an automatic method of generating a
realistic dataset according to the CBCT physics model is introduced. Numerical
simulations and clinical experiments show the feasibility of the proposed
method, which takes advantage of tooth surface information from intra-oral scan
data in 3D low dose maxillofacial CBCT modeling.",2022-02-08T00:24:41Z,http://arxiv.org/abs/2202.03571v1,dental implant
