title,authors,summary,published,link,keyword_used
Automatic Recognition of Landmarks on Digital Dental Models,"Brénainn Woodsend, Eirini Koufoudaki, Peter A. Mossey, Ping Lin","Fundamental to improving Dental and Orthodontic treatments is the ability to
quantitatively assess and cross-compare their outcomes. Such assessments
require calculating distances and angles from 3D coordinates of dental
landmarks. The costly and repetitive task of hand-labelling dental models
impedes studies requiring large sample size to penetrate statistical noise. We
have developed techniques and software implementing these techniques to map out
automatically, 3D dental scans. This process is divided into consecutive steps
- determining a model's orientation, separating and identifying the individual
tooth and finding landmarks on each tooth - described in this paper. Examples
to demonstrate techniques and the software and discussions on remaining issues
are provided as well. The software is originally designed to automate Modified
Huddard Bodemham (MHB) landmarking for assessing cleft lip/palate patients.
Currently only MHB landmarks are supported, but is extendable to any
predetermined landmarks. This software, coupled with intra-oral scanning
innovation, should supersede the arduous and error prone plaster model and
caliper approach to Dental research and provide a stepping-stone towards
automation of routine clinical assessments such as ""index of orthodontic
treatment need"" (IOTN).",2020-12-23T20:14:00Z,http://arxiv.org/abs/2012.12946v1,dental
"Dental CLAIRES: Contrastive LAnguage Image REtrieval Search for Dental
  Research","Tanjida Kabir, Luyao Chen, Muhammad F Walji, Luca Giancardo, Xiaoqian Jiang, Shayan Shams","Learning about diagnostic features and related clinical information from
dental radiographs is important for dental research. However, the lack of
expert-annotated data and convenient search tools poses challenges. Our primary
objective is to design a search tool that uses a user's query for oral-related
research. The proposed framework, Contrastive LAnguage Image REtrieval Search
for dental research, Dental CLAIRES, utilizes periapical radiographs and
associated clinical details such as periodontal diagnosis, demographic
information to retrieve the best-matched images based on the text query. We
applied a contrastive representation learning method to find images described
by the user's text by maximizing the similarity score of positive pairs (true
pairs) and minimizing the score of negative pairs (random pairs). Our model
achieved a hit@3 ratio of 96% and a Mean Reciprocal Rank (MRR) of 0.82. We also
designed a graphical user interface that allows researchers to verify the
model's performance with interactions.",2023-06-27T17:47:12Z,http://arxiv.org/abs/2306.15651v1,dental
"Improving Dental Diagnostics: Enhanced Convolution with Spatial
  Attention Mechanism","Shahriar Rezaie, Neda Saberitabar, Elnaz Salehi","Deep learning has emerged as a transformative tool in healthcare, offering
significant advancements in dental diagnostics by analyzing complex imaging
data. This paper presents an enhanced ResNet50 architecture, integrated with
the SimAM attention module, to address the challenge of limited contrast in
dental images and optimize deep learning performance while mitigating
computational demands. The SimAM module, incorporated after the second ResNet
block, refines feature extraction by capturing spatial dependencies and
enhancing significant features. Our model demonstrates superior performance
across various feature extraction techniques, achieving an F1 score of 0.676
and outperforming traditional architectures such as VGG, EfficientNet,
DenseNet, and AlexNet. This study highlights the effectiveness of our approach
in improving classification accuracy and robustness in dental image analysis,
underscoring the potential of deep learning to enhance diagnostic accuracy and
efficiency in dental care. The integration of advanced AI models like ours is
poised to revolutionize dental diagnostics, contributing to better patient
outcomes and the broader adoption of AI in dentistry.",2024-07-11T01:12:30Z,http://arxiv.org/abs/2407.08114v1,dental
"Development of a computer-aided design software for dental splint in
  orthognathic surgery","Xiaojun Chen, Xing Li, Lu Xu, Yi Sun, Constantinus Politis, Jan Egger","In the orthognathic surgery, dental splints are important and necessary to
help the surgeon reposition the maxilla or mandible. However, the traditional
methods of manual design of dental splints are difficult and time-consuming.
The research on computer-aided design software for dental splints is rarely
reported. Our purpose is to develop a novel special software named EasySplint
to design the dental splints conveniently and efficiently. The design can be
divided into two steps, which are the generation of initial splint base and the
Boolean operation between it and the maxilla-mandibular model. The initial
splint base is formed by ruled surfaces reconstructed using the manually picked
points. Then, a method to accomplish Boolean operation based on the distance
filed of two meshes is proposed. The interference elimination can be conducted
on the basis of marching cubes algorithm and Boolean operation. The accuracy of
the dental splint can be guaranteed since the original mesh is utilized to form
the result surface. Using EasySplint, the dental splints can be designed in
about 10 minutes and saved as a stereo lithography (STL) file for 3D printing
in clinical applications. Three phantom experiments were conducted and the
efficiency of our method was demonstrated.",2017-03-09T09:45:30Z,http://arxiv.org/abs/1703.03199v1,dental
"Multiclass Segmentation using Teeth Attention Modules for Dental X-ray
  Images","Afnan Ghafoor, Seong-Yong Moon, Bumshik Lee","This paper proposed a cutting-edge multiclass teeth segmentation architecture
that integrates an M-Net-like structure with Swin Transformers and a novel
component named Teeth Attention Block (TAB). Existing teeth image segmentation
methods have issues with less accurate and unreliable segmentation outcomes due
to the complex and varying morphology of teeth, although teeth segmentation in
dental panoramic images is essential for dental disease diagnosis. We propose a
novel teeth segmentation model incorporating an M-Net-like structure with Swin
Transformers and TAB. The proposed TAB utilizes a unique attention mechanism
that focuses specifically on the complex structures of teeth. The attention
mechanism in TAB precisely highlights key elements of teeth features in
panoramic images, resulting in more accurate segmentation outcomes. The
proposed architecture effectively captures local and global contextual
information, accurately defining each tooth and its surrounding structures.
Furthermore, we employ a multiscale supervision strategy, which leverages the
left and right legs of the U-Net structure, boosting the performance of the
segmentation with enhanced feature representation. The squared Dice loss is
utilized to tackle the class imbalance issue, ensuring accurate segmentation
across all classes. The proposed method was validated on a panoramic teeth
X-ray dataset, which was taken in a real-world dental diagnosis. The
experimental results demonstrate the efficacy of our proposed architecture for
tooth segmentation on multiple benchmark dental image datasets, outperforming
existing state-of-the-art methods in objective metrics and visual examinations.
This study has the potential to significantly enhance dental image analysis and
contribute to advances in dental applications.",2023-11-07T06:20:34Z,http://arxiv.org/abs/2311.03749v1,dental
"Bayesian Nonparametric Policy Search with Application to Periodontal
  Recall Intervals","Qian Guan, Brian J. Reich, Eric B. Laber, Dipankar Bandyopadhyay","Tooth loss from periodontal disease is a major public health burden in the
United States. Standard clinical practice is to recommend a dental visit every
six months; however, this practice is not evidence-based, and poor dental
outcomes and increasing dental insurance premiums indicate room for
improvement. We consider a tailored approach that recommends recall time based
on patient characteristics and medical history to minimize disease progression
without increasing resource expenditures. We formalize this method as a dynamic
treatment regime which comprises a sequence of decisions, one per stage of
intervention, that follow a decision rule which maps current patient
information to a recommendation for their next visit time. The dynamics of
periodontal health, visit frequency, and patient compliance are complex, yet
the estimated optimal regime must be interpretable to domain experts if it is
to be integrated into clinical practice. We combine non-parametric Bayesian
dynamics modeling with policy-search algorithms to estimate the optimal dynamic
treatment regime within an interpretable class of regimes. Both simulation
experiments and application to a rich database of electronic dental records
from the HealthPartners HMO shows that our proposed method leads to better
dental health without increasing the average recommended recall time relative
to competing methods.",2018-10-10T02:32:12Z,http://arxiv.org/abs/1810.04338v1,dental
"A convolutional neural network for teeth margin detection on
  3-dimensional dental meshes","Hu Chen, Hong Li, Bifu Hu, Kenan Ma, Yuchun Sun","We proposed a convolutional neural network for vertex classification on
3-dimensional dental meshes, and used it to detect teeth margins. An expanding
layer was constructed to collect statistic values of neighbor vertex features
and compute new features for each vertex with convolutional neural networks. An
end-to-end neural network was proposed to take vertex features, including
coordinates, curvatures and distance, as input and output each vertex
classification label. Several network structures with different parameters of
expanding layers and a base line network without expanding layers were designed
and trained by 1156 dental meshes. The accuracy, recall and precision were
validated on 145 dental meshes to rate the best network structures, which were
finally tested on another 144 dental meshes. All networks with our expanding
layers performed better than baseline, and the best one achieved an accuracy of
0.877 both on validation dataset and test dataset.",2021-07-07T06:16:17Z,http://arxiv.org/abs/2107.03030v1,dental
"Developing a Novel Approach for Periapical Dental Radiographs
  Segmentation","Elaheh Hatamimajoumerd, Farshad Tajeripour","Image processing techniques has been widely used in dental researches such as
human identification and forensic dentistry, teeth numbering, dental carries
detection and periodontal disease analysis. One of the most challenging parts
in dental imaging is teeth segmentation and how to separate them from each
other. In this paper, an automated method for teeth segmentation of Periapical
dental x-ray images which contain at least one root-canalled tooth is proposed.
The result of this approach can be used as an initial step in bone lesion
detection. The proposed algorithm is made of two stages. The first stage is
pre-processing. The second and main part of this algorithm calculated rotation
degree and uses the integral projection method for tooth isolation.
Experimental results show that this algorithm is robust and achieves high
accuracy.",2021-11-13T17:25:35Z,http://arxiv.org/abs/2111.07156v2,dental
"CTooth+: A Large-scale Dental Cone Beam Computed Tomography Dataset and
  Benchmark for Tooth Volume Segmentation","Weiwei Cui, Yaqi Wang, Yilong Li, Dan Song, Xingyong Zuo, Jiaojiao Wang, Yifan Zhang, Huiyu Zhou, Bung san Chong, Liaoyuan Zeng, Qianni Zhang","Accurate tooth volume segmentation is a prerequisite for computer-aided
dental analysis. Deep learning-based tooth segmentation methods have achieved
satisfying performances but require a large quantity of tooth data with ground
truth. The dental data publicly available is limited meaning the existing
methods can not be reproduced, evaluated and applied in clinical practice. In
this paper, we establish a 3D dental CBCT dataset CTooth+, with 22 fully
annotated volumes and 146 unlabeled volumes. We further evaluate several
state-of-the-art tooth volume segmentation strategies based on fully-supervised
learning, semi-supervised learning and active learning, and define the
performance principles. This work provides a new benchmark for the tooth volume
segmentation task, and the experiment can serve as the baseline for future
AI-based dental imaging research and clinical application development.",2022-08-02T09:13:23Z,http://arxiv.org/abs/2208.01643v1,dental
"Lack of corundum, carbon residues and revealing gaps on dental implants","Guy Florian Draenert, Gergo Mitov","Surface modification is an important topic to improve dental implants.
Corundum residues, which are part of current dental implant blasting,
disappeared on Straumann dental implants in recent publications. In our
investigations of the surface of 4 different Straumann implants using scanning
electron microscopy (SEM) and energy-dispersive X-ray spectroscopy (EDX) we
found the following three main findings: surfaces are nearly corundum-free,
disseminated gap-framed corundum particles and significant molecular carbon
residues. The data strongly suggest that Straumann applies a modified surface
technology on dental implants to remove corundum residues and involving unclear
carbons. One explanation could be, a Straumann patent involving a dextran
coating allowing easy corundum particle removal by aqueous solution, while
unintended molecular carbon residues cannot explain all findings. This change
of the production process without a new approval by the FDA would be a
violation of US federal law and the carbon bindings are a possible danger to
patients.",2022-09-13T04:45:44Z,http://arxiv.org/abs/2209.05728v1,dental
"Nonlinear ill-posed problem in low-dose dental cone-beam computed
  tomography","Hyoung Suk Park, Chang Min Hyun, Jin Keun Seo","This paper describes the mathematical structure of the ill-posed nonlinear
inverse problem of low-dose dental cone-beam computed tomography (CBCT) and
explains the advantages of a deep learning-based approach to the reconstruction
of computed tomography images over conventional regularization methods. This
paper explains the underlying reasons why dental CBCT is more ill-posed than
standard computed tomography. Despite this severe ill-posedness, the demand for
dental CBCT systems is rapidly growing because of their cost competitiveness
and low radiation dose. We then describe the limitations of existing methods in
the accurate restoration of the morphological structures of teeth using dental
CBCT data severely damaged by metal implants. We further discuss the usefulness
of panoramic images generated from CBCT data for accurate tooth segmentation.
We also discuss the possibility of utilizing radiation-free intra-oral scan
data as prior information in CBCT image reconstruction to compensate for the
damage to data caused by metal implants.",2023-03-03T02:46:15Z,http://arxiv.org/abs/2303.01678v1,dental
"A Sequential Framework for Detection and Classification of Abnormal
  Teeth in Panoramic X-rays","Tudor Dascalu, Shaqayeq Ramezanzade, Azam Bakhshandeh, Lars Bjorndal, Bulat Ibragimov","This paper describes our solution for the Dental Enumeration and Diagnosis on
Panoramic X-rays Challenge at MICCAI 2023. Our approach consists of a
multi-step framework tailored to the task of detecting and classifying abnormal
teeth. The solution includes three sequential stages: dental instance
detection, healthy instance filtering, and abnormal instance classification. In
the first stage, we employed a Faster-RCNN model for detecting and identifying
teeth. In subsequent stages, we designed a model that merged the encoding
pathway of a pretrained U-net, optimized for dental lesion detection, with the
Vgg16 architecture. The resulting model was first used for filtering out
healthy teeth. Then, any identified abnormal teeth were categorized,
potentially falling into one or more of the following conditions: embedded,
periapical lesion, caries, deep caries. The model performing dental instance
detection achieved an AP score of 0.49. The model responsible for identifying
healthy teeth attained an F1 score of 0.71. Meanwhile, the model trained for
multi-label dental disease classification achieved an F1 score of 0.76. The
code is available at
https://github.com/tudordascalu/2d-teeth-detection-challenge.",2023-08-31T13:47:01Z,http://arxiv.org/abs/2309.00027v2,dental
Cone-beam CT for Dental Radiography,"Kaspar Höschel, Janos Juhasz","The cone beam computed tomography (CBCT) technique was first inserted in
dental imaging 15 years ago. Due to this technique 3D imaging in dentistry has
been excessively changed. The purpose beyond using CBCT instead of computed
tomography (CT) imaging is that CT can not be used in many cases in dentistry,
in addition to the higher radiation and cost of CT. Nowadays, CBCT can be
applied in diagnostics for several dental specialties because of the variety of
services it offers and the specification of use. In contrast to CT, CBCT has
shown great benefits in endodontics, implant planning oral and maxillofacial
surgery and even in orthodontics.",2018-12-10T16:13:38Z,http://arxiv.org/abs/1812.03900v1,dental
Machine Learning for Dental Image Analysis,Young-jun Yu,"In order to study the application of artificial intelligence (AI) to dental
imaging, we applied AI technology to classify a set of panoramic radiographs
using (a) a convolutional neural network (CNN) which is a form of an artificial
neural network (ANN), (b) representative image cognition algorithms that
implement scale-invariant feature transform (SIFT), and (c) histogram of
oriented gradients (HOG).",2016-11-30T01:17:34Z,http://arxiv.org/abs/1611.09958v2,dental
"Step-by-Step Guide to Conducting Meta-Analysis of Dichotomous Outcomes
  Using RevMan in Dental Research Step-by-Step Guide to Conducting
  Meta-Analysis of Dichotomous Outcomes Using RevMan in Dental Research","Hoi-Jeong Lim, Su-Hyeon Park","Meta-analysis is a statistical method that combines the results of individual
studies on the same topic. This method is becoming popular, due to providing
the combined result that individual studies cannot provide and giving a more
precise result. Despite meta-analysis having such significance, there are few
Korean guides for the use of the Review Manager (RevMan) software. This study
will provide a step-by-step guide, using orthodontic mini-screw as a dental
example, to help researcher carry out meta-analysis more easily and accurately.",2025-02-27T11:54:55Z,http://arxiv.org/abs/2502.20019v1,dental
Environmental Influence on Dental Morphology,"Alessandro Riga, Maria Giovanna Belcastro, Jacopo Moggi-Cecchi","Development is a complex phenomenon where the forming phenotype interacts
with genetic and environmental inputs. Teeth are an important model for
developmental studies and their development has been thoroughly investigated.
However, despite of a large literature on the genetics of dental development,
no studies have focused yet on the environmental influences on dental
morphology. Here, we aim to test whether and to what extent the environment
plays a role in producing morphological variation in human teeth. We selected a
sample of modern human skulls and we used dental enamel hypoplasia as an
environmental stress marker in order to identify two groups with different
stress level, referred to as SG (""stressed"" group) and NSG (""non-stressed""
group). We collected data on the occurrence and the relative development of 15
morphological traits (5 for each molar) on upper molars using a standard
methodology commonly used in dental anthropology (ASU-DAS system) and then we
compared the frequencies of the traits in the two groups. Overall, the results
suggest that: (i) stressors like malnutrition and/or systemic diseases have a
significant effect on upper molar morphology; (ii) stress generates a
developmental response which increases the morphological variability of the SG;
(iii) the increase of variability is directional, since individuals belonging
to the SG have increased cusps dimensions and number. These results are
consistent with the expectations of the morphodynamic model of dental
development (Jernvall, 1995).",2013-01-30T19:20:42Z,http://arxiv.org/abs/1301.7334v2,dental
Teeth3DS+: An Extended Benchmark for Intraoral 3D Scans Analysis,"Achraf Ben-Hamadou, Nour Neifar, Ahmed Rekik, Oussama Smaoui, Firas Bouzguenda, Sergi Pujades, Edmond Boyer, Edouard Ladroit","Intraoral 3D scans analysis is a fundamental aspect of Computer-Aided
Dentistry (CAD) systems, playing a crucial role in various dental applications,
including teeth segmentation, detection, labeling, and dental landmark
identification. Accurate analysis of 3D dental scans is essential for
orthodontic and prosthetic treatment planning, as it enables automated
processing and reduces the need for manual adjustments by dental professionals.
However, developing robust automated tools for these tasks remains a
significant challenge due to the limited availability of high-quality public
datasets and benchmarks. This article introduces Teeth3DS+, the first
comprehensive public benchmark designed to advance the field of intraoral 3D
scan analysis. Developed as part of the 3DTeethSeg 2022 and 3DTeethLand 2024
MICCAI challenges, Teeth3DS+ aims to drive research in teeth identification,
segmentation, labeling, 3D modeling, and dental landmarks identification. The
dataset includes at least 1,800 intraoral scans (containing 23,999 annotated
teeth) collected from 900 patients, covering both upper and lower jaws
separately. All data have been acquired and validated by experienced
orthodontists and dental surgeons with over five years of expertise. Detailed
instructions for accessing the dataset are available at
https://crns-smartvision.github.io/teeth3ds",2022-10-12T11:18:35Z,http://arxiv.org/abs/2210.06094v2,dental
Multi-task Video Enhancement for Dental Interventions,"Efklidis Katsaros, Piotr K. Ostrowski, Krzysztof Włódarczak, Emilia Lewandowska, Jacek Ruminski, Damian Siupka-Mróz, Łukasz Lassmann, Anna Jezierska, Daniel Węsierski","A microcamera firmly attached to a dental handpiece allows dentists to
continuously monitor the progress of conservative dental procedures. Video
enhancement in video-assisted dental interventions alleviates low-light, noise,
blur, and camera handshakes that collectively degrade visual comfort. To this
end, we introduce a novel deep network for multi-task video enhancement that
enables macro-visualization of dental scenes. In particular, the proposed
network jointly leverages video restoration and temporal alignment in a
multi-scale manner for effective video enhancement. Our experiments on videos
of natural teeth in phantom scenes demonstrate that the proposed network
achieves state-of-the-art results in multiple tasks with near real-time
processing. We release Vident-lab at https://doi.org/10.34808/1jby-ay90, the
first dataset of dental videos with multi-task labels to facilitate further
research in relevant video processing applications.",2022-10-25T13:17:59Z,http://arxiv.org/abs/2210.16236v1,dental
Segmentation of 3D Dental Images Using Deep Learning,Omar Boudraa,"3D image segmentation is a recent and crucial step in many medical analysis
and recognition schemes. In fact, it represents a relevant research subject and
a fundamental challenge due to its importance and influence. This paper
provides a multi-phase Deep Learning-based system that hybridizes various
efficient methods in order to get the best 3D segmentation output. First, to
reduce the amount of data and accelerate the processing time, the application
of Decimate compression technique is suggested and justified. We then use a CNN
model to segment dental images into fifteen separated classes. In the end, a
special KNN-based transformation is applied for the purpose of removing
isolated meshes and of correcting dental forms. Experimentations demonstrate
the precision and the robustness of the selected framework applied to 3D dental
images within a private clinical benchmark.",2022-07-19T23:17:54Z,http://arxiv.org/abs/2207.09582v2,dental
"DeepOPG: Improving Orthopantomogram Finding Summarization with Weak
  Supervision","Tzu-Ming Harry Hsu, Yin-Chih Chelsea Wang","Clinical finding summaries from an orthopantomogram, or a dental panoramic
radiograph, have significant potential to improve patient communication and
speed up clinical judgments. While orthopantomogram is a first-line tool for
dental examinations, no existing work has explored the summarization of
findings from it. A finding summary has to find teeth in the imaging study and
label the teeth with several types of past treatments. To tackle the problem,
we developDeepOPG that breaks the summarization process into functional
segmentation and tooth localization, the latter of which is further refined by
a novel dental coherence module. We also leverage weak supervision labels to
improve detection results in a reinforcement learning scenario. Experiments
show high efficacy of DeepOPG on finding summarization, achieving an overall
AUC of 88.2% in detecting six types of findings. The proposed dental coherence
and weak supervision both are shown to improve DeepOPG by adding 5.9% and 0.4%
to AP@IoU=0.5.",2021-03-15T11:28:45Z,http://arxiv.org/abs/2103.08290v2,dental
