title,authors,summary,published,link,keyword_used
"Generative Adversarial Networks for Dental Patient Identity Protection
  in Orthodontic Educational Imaging","Mingchuan Tian, Wilson Weixun Lu, Kelvin Weng Chiong Foong, Eugene Loh","Objectives: This research introduces a novel area-preserving Generative
Adversarial Networks (GAN) inversion technique for effectively de-identifying
dental patient images. This innovative method addresses privacy concerns while
preserving key dental features, thereby generating valuable resources for
dental education and research.
  Methods: We enhanced the existing GAN Inversion methodology to maximize the
preservation of dental characteristics within the synthesized images. A
comprehensive technical framework incorporating several deep learning models
was developed to provide end-to-end development guidance and practical
application for image de-identification.
  Results: Our approach was assessed with varied facial pictures, extensively
used for diagnosing skeletal asymmetry and facial anomalies. Results
demonstrated our model's ability to adapt the context from one image to
another, maintaining compatibility, while preserving dental features essential
for oral diagnosis and dental education. A panel of five clinicians conducted
an evaluation on a set of original and GAN-processed images. The generated
images achieved effective de-identification, maintaining the realism of
important dental features and were deemed useful for dental diagnostics and
education.
  Clinical Significance: Our GAN model and the encompassing framework can
streamline the de-identification process of dental patient images, enhancing
efficiency in dental education. This method improves students' diagnostic
capabilities by offering more exposure to orthodontic malocclusions.
Furthermore, it facilitates the creation of de-identified datasets for broader
2D image research at major research institutions.",2023-07-05T04:14:57Z,http://arxiv.org/abs/2307.02019v1,dental implant
"Sub-Band-Gap Absorption Mechanisms Involving Oxygen Vacancies in
  Hydroxyapatite","Vladimir S. Bystrov, Leon A. Avakyan, Ekaterina V. Paramonova, José Coutinho","Hydroxyapatite (HAp) is a widely used biomaterial for the preparation of bone
and dental implants. Despite the relevance of HAp in medicine, exciting
applications involving this material as a bio-compatible photocatalyst, depend
on how well we understand its fundamental properties. Experimental evidence
suggests that oxygen vacancies play a critical role in the production of
surface radicals upon exposure of HAp to ultra-violet (UV) light. However, very
little is known about the underlying physical and chemical details. We present
a hybrid density-functional study of the structural and electronic properties
of oxygen vacancies in large HAp supercells within the plane-wave formalism. We
find that under equilibrium conditions, vacancies occur either as a simple
vacant oxygen site (in the neutral charge state), or as extended structures
replacing several crystalline moieties (in the double plus charge state). Large
atomic relaxations upon ionization make the oxygen vacancy a negative-$U$
defect, where the single plus charge state is metastable, being only accessible
under UV excitation. From inspection of the transition levels, we find that
electron promotion from the valence band top to the donor state of the vacancy,
involves a zero-phonon transition of 3.6-3.9 eV. This mechanism is the most
likely explanation to the 3.4-4.0 eV absorption onset for the observation of
photocatalysis using HAp under persistent UV illumination.",2019-03-03T21:19:13Z,http://arxiv.org/abs/1903.00992v1,dental implant
Superiorized method for metal artifact reduction,"T. Humphries, J. Wang","Metal artifact reduction (MAR) is a challenging problem in computed
tomography (CT) imaging. A popular class of MAR methods replace sinogram
measurements that are corrupted by metal with artificial data. While these
``projection completion'' approaches are successful in eliminating severe
artifacts, secondary artifacts may be introduced by the artificial data. In
this paper, we propose an approach which uses projection completion to generate
a prior image, which is then incorporated into an iterative reconstruction
algorithm based on the superiorization framework. The prior image is
reconstructed using normalized metal artifact reduction (NMAR), a popular
projection completion approach. The iterative algorithm is a modified version
of the simultaneous algebraic reconstruction technique (SART), which reduces
artifacts by incorporating a polyenergetic forward model, least-squares
weighting, and superiorization. The penalty function used for superiorization
is a weighted average between a total variation (TV) term and a term promoting
similarity with the prior image, similar to penalty functions used in prior
image constrained compressive sensing. Because the prior is largely free of
severe metal artifacts, these artifacts are discouraged from arising during
iterative reconstruction; additionally, because the iterative approach uses the
original projection data, it is able to recover information that is lost during
the NMAR process. We perform numerical experiments modeling a simple geometric
object, as well as several more realistic scenarios such as metal pins,
bilateral hip implants, and dental fillings placed within an anatomical
phantom. The proposed iterative algorithm is largely successful at eliminating
severe metal artifacts as well as secondary artifacts introduced by the NMAR
process, especially lost edges of bone structures in the neighborhood of the
metal regions.",2020-03-10T00:47:05Z,http://arxiv.org/abs/2003.04479v1,dental implant
