title,authors,summary,published,link,keyword_used
"ToF-SIMS Investigations on Dental Implant Materials and Adsorbed Protein
  Films",Falk Bernsmann,"In this work the two experimental dental implant materials FAT and FAW, made
of fluoroapatite particles embedded in polymer matrices, and films of the
proteins lysozyme, amylase and bovine serum albumin (BSA), adsorbed to the two
dental implant materials, were investigated with time-of-flight secondary ion
mass spectrometry (ToF-SIMS) and the multivariate data analysis technique
discriminant principal component analysis (DPCA).",2011-06-23T07:21:11Z,http://arxiv.org/abs/1106.4644v1,dental implant
"Accurate 3D Prediction of Missing Teeth in Diverse Patterns for Precise
  Dental Implant Planning","Lei Ma, Peng Xue, Yuning Gu, Yue Zhao, Min Zhu, Zhongxiang Ding, Dinggang Shen","In recent years, the demand for dental implants has surged, driven by their
high success rates and esthetic advantages. However, accurate prediction of
missing teeth for precise digital implant planning remains a challenge due to
the intricate nature of dental structures and the variability in tooth loss
patterns. This study presents a novel framework for accurate prediction of
missing teeth in different patterns, facilitating digital implant planning. The
proposed framework begins by estimating point-to-point correspondence among a
dataset of dental mesh models reconstructed from CBCT images of healthy
subjects. Subsequently, tooth dictionaries are constructed for each tooth type,
encoding their position and shape information based on the established
point-to-point correspondence. To predict missing teeth in a given dental mesh
model, sparse coefficients are learned by sparsely representing adjacent teeth
of the missing teeth using the corresponding tooth dictionaries. These
coefficients are then applied to the dictionaries of the missing teeth to
generate accurate predictions of their positions and shapes. The evaluation
results on real subjects shows that our proposed framework achieves an average
prediction error of 1.04mm for predictions of single missing tooth and an
average prediction error of 1.33mm for the prediction of 14 missing teeth,
which demonstrates its capability of accurately predicting missing teeth in
various patterns. By accurately predicting missing teeth, dental professionals
can improve the planning and placement of dental implants, leading to better
esthetic and functional outcomes for patients undergoing dental implant
procedures.",2023-07-16T05:52:37Z,http://arxiv.org/abs/2307.07953v1,dental implant
"Lack of corundum, carbon residues and revealing gaps on dental implants","Guy Florian Draenert, Gergo Mitov","Surface modification is an important topic to improve dental implants.
Corundum residues, which are part of current dental implant blasting,
disappeared on Straumann dental implants in recent publications. In our
investigations of the surface of 4 different Straumann implants using scanning
electron microscopy (SEM) and energy-dispersive X-ray spectroscopy (EDX) we
found the following three main findings: surfaces are nearly corundum-free,
disseminated gap-framed corundum particles and significant molecular carbon
residues. The data strongly suggest that Straumann applies a modified surface
technology on dental implants to remove corundum residues and involving unclear
carbons. One explanation could be, a Straumann patent involving a dextran
coating allowing easy corundum particle removal by aqueous solution, while
unintended molecular carbon residues cannot explain all findings. This change
of the production process without a new approval by the FDA would be a
violation of US federal law and the carbon bindings are a possible danger to
patients.",2022-09-13T04:45:44Z,http://arxiv.org/abs/2209.05728v1,dental implant
"Local tissue effects and peri-implant bone healing induced by implant
  surface treatment: an in vivo study in the sheep","Nicolas Rousseau, Ines Msolli, Patrick Chabrand, Arnaud Destainville, Olivier Richart, Jean-Louis Milan","Objective: The aim of this study was to assess, through biological analysis,
the local effects and osseointegration of dental implants incorporating surface
micro/nanofeatures compared to implants of identical design without surface
treatment. Background: Known to impact bone cell behavior, surface chemical and
topography modifications target improved osseointegration and long-term success
of dental implants. Very few studies assess the performance of implants
presenting both micro-and nanofeatures in vivo on the animal models used in
preclinical studies for medical device certification. Methods: Implant surfaces
were characterized in terms of topography and surface chemical composition.
After 4 weeks and 13 weeks of implantation in sheep femoral condyles, forty
implants were evaluated through micro-computed tomography, histopathologic, and
histomorphometric analyses. Results: No local adverse effects were observed
around implants. Histomorphometric analyses showed significantly higher
bone-to-implant contact in the coronal region of the surface treated implant at
week 4 and week 13, respectively 79.3$\pm$11.2% and 86.4$\pm$6.7%, compared to
the untreated implant's 68.3$\pm$8.8% and 74.8$\pm$13%. Micro-computed
tomography analyses revealed that healing patterns differed between coronal and
apical regions, with higher coronal boneto-implant contact at week 13.
Histopathologic results showed, at week 13, bone healing around the surface
treated implant with undistinguishable defect margins while the untreated
implant still presented bone condensation and traces of the initial drill
defect. Conclusion: Our results suggest that the surface treated implant not
only shows no deleterious effects on local tissues but also promotes faster
bone healing around the implant. (word count: 241",2021-04-09T07:33:59Z,http://arxiv.org/abs/2104.04223v1,dental implant
"TCSloT: Text Guided 3D Context and Slope Aware Triple Network for Dental
  Implant Position Prediction","Xinquan Yang, Jinheng Xie, Xuechen Li, Xuguang Li, Linlin Shen, Yongqiang Deng","In implant prosthesis treatment, the surgical guide of implant is used to
ensure accurate implantation. However, such design heavily relies on the manual
location of the implant position. When deep neural network has been proposed to
assist the dentist in locating the implant position, most of them take a single
slice as input, which do not fully explore 3D contextual information and
ignoring the influence of implant slope. In this paper, we design a Text Guided
3D Context and Slope Aware Triple Network (TCSloT) which enables the perception
of contextual information from multiple adjacent slices and awareness of
variation of implant slopes. A Texture Variation Perception (TVP) module is
correspondingly elaborated to process the multiple slices and capture the
texture variation among slices and a Slope-Aware Loss (SAL) is proposed to
dynamically assign varying weights for the regression head. Additionally, we
design a conditional text guidance (CTG) module to integrate the text condition
(i.e., left, middle and right) from the CLIP for assisting the implant position
prediction. Extensive experiments on a dental implant dataset through five-fold
cross-validation demonstrated that the proposed TCSloT achieves superior
performance than existing methods.",2023-08-10T05:51:21Z,http://arxiv.org/abs/2308.05355v1,dental implant
"ImplantFormer: Vision Transformer based Implant Position Regression
  Using Dental CBCT Data","Xinquan Yang, Xuguang Li, Xuechen Li, Peixi Wu, Linlin Shen, Yongqiang Deng","Implant prosthesis is the most appropriate treatment for dentition defect or
dentition loss, which usually involves a surgical guide design process to
decide the implant position. However, such design heavily relies on the
subjective experiences of dentists. In this paper, a transformer-based Implant
Position Regression Network, ImplantFormer, is proposed to automatically
predict the implant position based on the oral CBCT data. We creatively propose
to predict the implant position using the 2D axial view of the tooth crown area
and fit a centerline of the implant to obtain the actual implant position at
the tooth root. Convolutional stem and decoder are designed to coarsely extract
image features before the operation of patch embedding and integrate
multi-level feature maps for robust prediction, respectively. As both
long-range relationship and local features are involved, our approach can
better represent global information and achieves better location performance.
Extensive experiments on a dental implant dataset through five-fold
cross-validation demonstrated that the proposed ImplantFormer achieves superior
performance than existing methods.",2022-10-29T02:31:27Z,http://arxiv.org/abs/2210.16467v3,dental implant
"Simplify Implant Depth Prediction as Video Grounding: A Texture Perceive
  Implant Depth Prediction Network","Xinquan Yang, Xuguang Li, Xiaoling Luo, Leilei Zeng, Yudi Zhang, Linlin Shen, Yongqiang Deng","Surgical guide plate is an important tool for the dental implant surgery.
However, the design process heavily relies on the dentist to manually simulate
the implant angle and depth. When deep neural networks have been applied to
assist the dentist quickly locates the implant position, most of them are not
able to determine the implant depth. Inspired by the video grounding task which
localizes the starting and ending time of the target video segment, in this
paper, we simplify the implant depth prediction as video grounding and develop
a Texture Perceive Implant Depth Prediction Network (TPNet), which enables us
to directly output the implant depth without complex measurements of oral bone.
TPNet consists of an implant region detector (IRD) and an implant depth
prediction network (IDPNet). IRD is an object detector designed to crop the
candidate implant volume from the CBCT, which greatly saves the computation
resource. IDPNet takes the cropped CBCT data to predict the implant depth. A
Texture Perceive Loss (TPL) is devised to enable the encoder of IDPNet to
perceive the texture variation among slices. Extensive experiments on a large
dental implant dataset demonstrated that the proposed TPNet achieves superior
performance than the existing methods.",2024-06-07T03:24:04Z,http://arxiv.org/abs/2406.04603v1,dental implant
Resonant frequency analysis of dental implants,"D Rittel, A Dorogoy, G. Haiat, K Shemtov-Yona","Dental implant stability influences the decision on the determination of the
duration between implant insertion and loading, This work investigates the
resonant frequency analysis by means of a numerical model. The investigation is
done numerically through the determination of the eigenfrequencies and
performing a steady state response analyses using a commercial finite element
package. A peri-implant interface, of simultaneously varying stiffness
(density) and layer thickness is introduced in the numerical 3D model in order
to probe the sensitivity of the eigenfrequencies and steady state response to
an evolving weakened layer, in an attempt to identify the bone reconstruction
around the implant. For the first two modes, the resonant frequency is somewhat
insensitive to the healing process, unless the weakened layer is rather large
and compliant, like in the very early stages of the implantation. A ""Normalized
Healing Factor"" is devised in the spirit of the Implant Stability Quotient,
which can identify the healing process especially at the early stages after
implantation. The sensitivity of the RFA to changes of mechanical properties of
periprosthetic bone tissue seems relatively weak. Another indicator considering
the amplitude as well as the resonance frequency might be more adapted to bone
healing estimations. However, these results need to be verified experimentally
as well as clinically.",2019-05-17T07:59:21Z,http://arxiv.org/abs/1905.07154v1,dental implant
"Nonlinear ill-posed problem in low-dose dental cone-beam computed
  tomography","Hyoung Suk Park, Chang Min Hyun, Jin Keun Seo","This paper describes the mathematical structure of the ill-posed nonlinear
inverse problem of low-dose dental cone-beam computed tomography (CBCT) and
explains the advantages of a deep learning-based approach to the reconstruction
of computed tomography images over conventional regularization methods. This
paper explains the underlying reasons why dental CBCT is more ill-posed than
standard computed tomography. Despite this severe ill-posedness, the demand for
dental CBCT systems is rapidly growing because of their cost competitiveness
and low radiation dose. We then describe the limitations of existing methods in
the accurate restoration of the morphological structures of teeth using dental
CBCT data severely damaged by metal implants. We further discuss the usefulness
of panoramic images generated from CBCT data for accurate tooth segmentation.
We also discuss the possibility of utilizing radiation-free intra-oral scan
data as prior information in CBCT image reconstruction to compensate for the
damage to data caused by metal implants.",2023-03-03T02:46:15Z,http://arxiv.org/abs/2303.01678v1,dental implant
"Emerging basic, clinical and translational research fronts in dental
  biomaterials R&D","David Fajardo-Ortiz, Pablo Jaramillo, Claudia Jaramillo, Raul Resendiz, Miguel Lara-Flores, Victor M. Castano","The current (2007-2007) structure and content of dental materials research
has been investigated by identifying and describing the emergent research
fronts which can be related to basic, translational and clinical observation
research. By a combination of network analysis and text mining of the
literature on dental materials indexed in the Web of Science, we have
identified eleven emerging research fronts. These fronts are related to
different dental materials applications which are at different levels in the
knowledge translation and biomedical innovation process. We identified fronts
related to dominant designs like titanium implants, competing technologies like
ceramics and composites applications to prothesis and restauration, and
disruptive technologies like nanomaterials and mineral trioxide aggregates. Our
results suggest the possible relation between the technological complexity of
the dental materials and the level of advance in terms of knowledge
translation. This is the first time the structure and content of research on
dental materials research is analyzed.",2017-11-30T00:30:24Z,http://arxiv.org/abs/1711.11168v1,dental implant
"Evaluation of dental implant stability in bone phantoms: comparison
  between a quantitative ultrasound technique and resonance frequency analysis","Romain Vayron, Vu Hieu Nguyen, Benoît Lecuelle, Guillaume Haiat","Background Resonance frequency analyses and quantitative ultrasound methods
have been suggested to assess dental implant primary stability. PurposeThe
purpose of this study was to compare the results obtained using these two
techniques applied to the same dental implants inserted in various bone
phantoms. Materials and MethodsDifferent values of trabecular bone density and
cortical thickness were considered to assess the effect of bone quality on the
respective indicators (UI and ISQ). The effect of the implant insertion depth
and of the final drill diameter was also investigated. ResultsISQ values
increase and UI values decrease as a function of trabecular density, cortical
thickness and the screwing of the implant. When the implant diameter varies,
the UI values are significantly different for all final drill diameters (except
for two), while the ISQ values are similar for all final drill diameters lower
than 3.2 mm and higher than 3.3 mm. The error on the estimation of parameters
with the QUS device is between 4 and 8 times lower compared to that made with
the RFA technique.ConclusionsThe results show that ultrasound technique
provides a better estimation of different parameters related to the implant
stability compared to the RFA technique.",2019-05-20T06:50:29Z,http://arxiv.org/abs/1905.08247v1,dental implant
Cone-beam CT for Dental Radiography,"Kaspar Höschel, Janos Juhasz","The cone beam computed tomography (CBCT) technique was first inserted in
dental imaging 15 years ago. Due to this technique 3D imaging in dentistry has
been excessively changed. The purpose beyond using CBCT instead of computed
tomography (CT) imaging is that CT can not be used in many cases in dentistry,
in addition to the higher radiation and cost of CT. Nowadays, CBCT can be
applied in diagnostics for several dental specialties because of the variety of
services it offers and the specification of use. In contrast to CT, CBCT has
shown great benefits in endodontics, implant planning oral and maxillofacial
surgery and even in orthodontics.",2018-12-10T16:13:38Z,http://arxiv.org/abs/1812.03900v1,dental implant
Two-Stream Regression Network for Dental Implant Position Prediction,"Xinquan Yang, Xuguang Li, Xuechen Li, Wenting Chen, Linlin Shen, Xin Li, Yongqiang Deng","In implant prosthesis treatment, the design of the surgical guide heavily
relies on the manual location of the implant position, which is subjective and
prone to doctor's experiences. When deep learning based methods has started to
be applied to address this problem, the space between teeth are various and
some of them might present similar texture characteristic with the actual
implant region. Both problems make a big challenge for the implant position
prediction. In this paper, we develop a two-stream implant position regression
framework (TSIPR), which consists of an implant region detector (IRD) and a
multi-scale patch embedding regression network (MSPENet), to address this
issue. For the training of IRD, we extend the original annotation to provide
additional supervisory information, which contains much more rich
characteristic and do not introduce extra labeling costs. A multi-scale patch
embedding module is designed for the MSPENet to adaptively extract features
from the images with various tooth spacing. The global-local feature
interaction block is designed to build the encoder of MSPENet, which combines
the transformer and convolution for enriched feature representation. During
inference, the RoI mask extracted from the IRD is used to refine the prediction
results of the MSPENet. Extensive experiments on a dental implant dataset
through five-fold cross-validation demonstrated that the proposed TSIPR
achieves superior performance than existing methods.",2023-05-17T08:37:26Z,http://arxiv.org/abs/2305.10044v3,dental implant
"TCEIP: Text Condition Embedded Regression Network for Dental Implant
  Position Prediction","Xinquan Yang, Jinheng Xie, Xuguang Li, Xuechen Li, Xin Li, Linlin Shen, Yongqiang Deng","When deep neural network has been proposed to assist the dentist in designing
the location of dental implant, most of them are targeting simple cases where
only one missing tooth is available. As a result, literature works do not work
well when there are multiple missing teeth and easily generate false
predictions when the teeth are sparsely distributed. In this paper, we are
trying to integrate a weak supervision text, the target region, to the implant
position regression network, to address above issues. We propose a text
condition embedded implant position regression network (TCEIP), to embed the
text condition into the encoder-decoder framework for improvement of the
regression performance. A cross-modal interaction that consists of cross-modal
attention (CMA) and knowledge alignment module (KAM) is proposed to facilitate
the interaction between features of images and texts. The CMA module performs a
cross-attention between the image feature and the text condition, and the KAM
mitigates the knowledge gap between the image feature and the image encoder of
the CLIP. Extensive experiments on a dental implant dataset through five-fold
cross-validation demonstrated that the proposed TCEIP achieves superior
performance than existing methods.",2023-06-26T03:38:43Z,http://arxiv.org/abs/2306.14406v2,dental implant
"The interplay between tissue healing and bone remodeling around
  immediately loaded tooth replacement implants","Soroush Irandoust, Sinan Muftu","Long-term bone healing/adaptation after a dental implant treatment starts
with diffusion of mesenchymal stem cells to the fracture callus and their
subsequent differentiation. The healing phase is followed by the
bone-remodeling phase. In this work, a mechano-regulatory cellular
differentiation model was used to simulate tissue healing around an immediately
loaded dental implant. All tissue types were modeled as poroelastic in the
healing phase. Material properties of the healing region were updated after
each loading cycle for 30 cycles (days). The tissue distribution in the healed
state was then used as the initial condition for the remodeling phase during
which regions healed into bone adapt their internal density with respect to a
homeostatic remodeling stimulus. The short- and long-term effects of
micro-motion on bone healing and remodeling were studied. Development of soft
tissue was observed both in the coronal region due to high fluid velocity, and
on the vertical sides of the healing-callus due to high shear stress. In cases
with small implant micromotion, tissue between the implant threads
differentiated into bone during the healing phase, but resorbed during
remodeling. In cases with large implant micromotion, higher percentage of the
healing region differentiated into soft tissue resulting in less volume
available for bone remodeling. But, the remaining bone region developed higher
density bone tissue. It was concluded that an optimal range of controlled
micromotion could be designed for a given implant in order to achieve the
desired functional properties.",2019-07-18T20:45:39Z,http://arxiv.org/abs/1907.08277v1,dental implant
"Surface texturing of Ti6Al4V alloy using femtosecond laser for superior
  antibacterial performance","Shazia Shaikh, Sunita Kedia, Deepti Singh, Mahesh Subramanian, Sucharita Sinha","Titanium and its alloy are most widely used implant materials in dental and
orthopaedic fields. However, infections occurring during implantation leads to
implant failure in most of the cases. Here, we have demonstrated antibacterial
behavior of Ti6Al4V alloy achieved when surface modified using femtosecond
laser beam. Post laser treatment conical microstructures were observed on the
Ti6Al4V alloy surface. Generation of different sub-oxide phases of titanium
dioxide were detected on laser treated samples using X-ray diffraction and
X-ray photoelectron spectroscopy. Wettability of Ti6Al4V alloy surface changed
significantly after interaction with the laser. Adhesion and growth of two gram
positive; Staphylococcus aureus and Streptococcus mutans and one gram negative
Pseudomonas aeruginosa bacteria have been explored on pristine, as well as, on
laser textured Ti6Al4V alloy surfaces. In-vitro investigation on agar plate
showed inhibition of bacterial growth on most of the laser treated surface.
Superior surface roughness and occurrence of magneli phases of titanium dioxide
on laser treated surface were probably responsible for the antibacterial
behavior exhibited by the laser treated samples. Therefore, femtosecond laser
surface treatment of Ti6Al4V alloy could find potential application in the
development of infection free medical implants for dental and orthopedic
usages.",2018-02-21T10:15:54Z,http://arxiv.org/abs/1802.07492v1,dental implant
"Effect of the geometry of butt-joint implant-supported restorations on
  the fatigue life of prosthetic screws","Mikel Armentia, Mikel Abasolo, Ibai Coria, Nicolas Saintier","Statement of problem. Dental implant geometry affects the mechanical
performance and fatigue behavior of butt-joint implant-supported restorations.
However, failure of the implant component has been generally studied by
ignoring the prosthetic screw, which is frequently the critical restoration
component Purpose. Evaluate the effect of 3 main implant geometric parameters:
the implant body diameter, the platform diameter, and the implant-abutment
connection type (external versus internal butt-joint) on the fatigue life of
the prosthetic screw. The experimental values were further compared with the
theoretical ones obtained by using a previously published methodology M&M. 4
different designs of direct-to-implant dental restorations from the
manufacturer BTI were tested. Forty-eight fatigue tests were performed in an
axial fatigue testing machine according to ISO 14801. Linear regression models,
95% interval confidence bands for the linear regression, and 95% prediction
intervals of the fatigue load-life results were obtained and compared through
an analysis of covariance to determine the influence of the 3 parameters under
study on the fatigue behavior Results. Linear regression models showed a
statistical difference when the implant body diameter was increased by 1 mm; an
average 3.5-fold increase in fatigue life was observed. Increasing the implant
abutment connection diameter by 1.4 mm also showed a significant difference,
leading to 7-fold longer fatigue life on average. No significant statistical
evidence was found to demonstrate a difference in fatigue life between internal
and external connections Conclusions. Increasing the implant platform and body
diameter significantly improved the fatigue life of the screw, whereas external
and internal connections provided similar results. In addition, experimental
results proved the accuracy of the fatigue life prediction methodology",2024-11-07T08:16:00Z,http://arxiv.org/abs/2411.04515v1,dental implant
