title,authors,summary,published,link,keyword_used
"Ammonia-Net: A Multi-task Joint Learning Model for Multi-class
  Segmentation and Classification in Tooth-marked Tongue Diagnosis","Shunkai Shi, Yuqi Wang, Qihui Ye, Yanran Wang, Yiming Zhu, Muhammad Hassan, Aikaterini Melliou, Dongmei Yu","In Traditional Chinese Medicine, the tooth marks on the tongue, stemming from
prolonged dental pressure, serve as a crucial indicator for assessing qi (yang)
deficiency, which is intrinsically linked to visceral health. Manual diagnosis
of tooth-marked tongue solely relies on experience. Nonetheless, the diversity
in shape, color, and type of tooth marks poses a challenge to diagnostic
accuracy and consistency. To address these problems, herein we propose a
multi-task joint learning model named Ammonia-Net. This model employs a
convolutional neural network-based architecture, specifically designed for
multi-class segmentation and classification of tongue images. Ammonia-Net
performs semantic segmentation of tongue images to identify tongue and tooth
marks. With the assistance of segmentation output, it classifies the images
into the desired number of classes: healthy tongue, light tongue, moderate
tongue, and severe tongue. As far as we know, this is the first attempt to
apply the semantic segmentation results of tooth marks for tooth-marked tongue
classification. To train Ammonia-Net, we collect 856 tongue images from 856
subjects. After a number of extensive experiments, the experimental results
show that the proposed model achieves 99.06% accuracy in the two-class
classification task of tooth-marked tongue identification and 80.02%. As for
the segmentation task, mIoU for tongue and tooth marks amounts to 71.65%.",2023-10-05T11:28:32Z,http://arxiv.org/abs/2310.03472v1,tooth loss
"Automatic Tooth Arrangement with Joint Features of Point and Mesh
  Representations via Diffusion Probabilistic Models","Changsong Lei, Mengfei Xia, Shaofeng Wang, Yaqian Liang, Ran Yi, Yuhui Wen, Yongjin Liu","Tooth arrangement is a crucial step in orthodontics treatment, in which
aligning teeth could improve overall well-being, enhance facial aesthetics, and
boost self-confidence. To improve the efficiency of tooth arrangement and
minimize errors associated with unreasonable designs by inexperienced
practitioners, some deep learning-based tooth arrangement methods have been
proposed. Currently, most existing approaches employ MLPs to model the
nonlinear relationship between tooth features and transformation matrices to
achieve tooth arrangement automatically. However, the limited datasets (which
to our knowledge, have not been made public) collected from clinical practice
constrain the applicability of existing methods, making them inadequate for
addressing diverse malocclusion issues. To address this challenge, we propose a
general tooth arrangement neural network based on the diffusion probabilistic
model. Conditioned on the features extracted from the dental model, the
diffusion probabilistic model can learn the distribution of teeth
transformation matrices from malocclusion to normal occlusion by gradually
denoising from a random variable, thus more adeptly managing real orthodontic
data. To take full advantage of effective features, we exploit both mesh and
point cloud representations by designing different encoding networks to extract
the tooth (local) and jaw (global) features, respectively. In addition to
traditional metrics ADD, PA-ADD, CSA, and ME_{rot}, we propose a new evaluation
metric based on dental arch curves to judge whether the generated teeth meet
the individual normal occlusion. Experimental results demonstrate that our
proposed method achieves state-of-the-art tooth alignment results and
satisfactory occlusal relationships between dental arches. We will publish the
code and dataset.",2023-12-23T02:27:15Z,http://arxiv.org/abs/2312.15139v1,tooth loss
Tooth morphometry using quasi-conformal theory,"Gary P. T. Choi, Hei Long Chan, Robin Yong, Sarbin Ranjitkar, Alan Brook, Grant Townsend, Ke Chen, Lok Ming Lui","Shape analysis is important in anthropology, bioarchaeology and forensic
science for interpreting useful information from human remains. In particular,
teeth are morphologically stable and hence well-suited for shape analysis. In
this work, we propose a framework for tooth morphometry using quasi-conformal
theory. Landmark-matching Teichm\""uller maps are used for establishing a 1-1
correspondence between tooth surfaces with prescribed anatomical landmarks.
Then, a quasi-conformal statistical shape analysis model based on the
Teichm\""uller mapping results is proposed for building a tooth classification
scheme. We deploy our framework on a dataset of human premolars to analyze the
tooth shape variation among genders and ancestries. Experimental results show
that our method achieves much higher classification accuracy with respect to
both gender and ancestry when compared to the existing methods. Furthermore,
our model reveals the underlying tooth shape difference between different
genders and ancestries in terms of the local geometric distortion and
curvatures.",2019-01-07T03:00:12Z,http://arxiv.org/abs/1901.01651v1,tooth loss
"CTooth+: A Large-scale Dental Cone Beam Computed Tomography Dataset and
  Benchmark for Tooth Volume Segmentation","Weiwei Cui, Yaqi Wang, Yilong Li, Dan Song, Xingyong Zuo, Jiaojiao Wang, Yifan Zhang, Huiyu Zhou, Bung san Chong, Liaoyuan Zeng, Qianni Zhang","Accurate tooth volume segmentation is a prerequisite for computer-aided
dental analysis. Deep learning-based tooth segmentation methods have achieved
satisfying performances but require a large quantity of tooth data with ground
truth. The dental data publicly available is limited meaning the existing
methods can not be reproduced, evaluated and applied in clinical practice. In
this paper, we establish a 3D dental CBCT dataset CTooth+, with 22 fully
annotated volumes and 146 unlabeled volumes. We further evaluate several
state-of-the-art tooth volume segmentation strategies based on fully-supervised
learning, semi-supervised learning and active learning, and define the
performance principles. This work provides a new benchmark for the tooth volume
segmentation task, and the experiment can serve as the baseline for future
AI-based dental imaging research and clinical application development.",2022-08-02T09:13:23Z,http://arxiv.org/abs/2208.01643v1,tooth loss
"A Critical Analysis of the Limitation of Deep Learning based 3D Dental
  Mesh Segmentation Methods in Segmenting Partial Scans","Ananya Jana, Aniruddha Maiti, Dimitris N. Metaxas","Tooth segmentation from intraoral scans is a crucial part of digital
dentistry. Many Deep Learning based tooth segmentation algorithms have been
developed for this task. In most of the cases, high accuracy has been achieved,
although, most of the available tooth segmentation techniques make an implicit
restrictive assumption of full jaw model and they report accuracy based on full
jaw models. Medically, however, in certain cases, full jaw tooth scan is not
required or may not be available. Given this practical issue, it is important
to understand the robustness of currently available widely used Deep Learning
based tooth segmentation techniques. For this purpose, we applied available
segmentation techniques on partial intraoral scans and we discovered that the
available deep Learning techniques under-perform drastically. The analysis and
comparison presented in this work would help us in understanding the severity
of the problem and allow us to develop robust tooth segmentation technique
without strong assumption of full jaw model.",2023-04-29T11:58:23Z,http://arxiv.org/abs/2305.00244v1,tooth loss
"AI-enabled Automatic Multimodal Fusion of Cone-Beam CT and Intraoral
  Scans for Intelligent 3D Tooth-Bone Reconstruction and Clinical Applications","Jin Hao, Jiaxiang Liu, Jin Li, Wei Pan, Ruizhe Chen, Huimin Xiong, Kaiwei Sun, Hangzheng Lin, Wanlu Liu, Wanghui Ding, Jianfei Yang, Haoji Hu, Yueling Zhang, Yang Feng, Zeyu Zhao, Huikai Wu, Youyi Zheng, Bing Fang, Zuozhu Liu, Zhihe Zhao","A critical step in virtual dental treatment planning is to accurately
delineate all tooth-bone structures from CBCT with high fidelity and accurate
anatomical information. Previous studies have established several methods for
CBCT segmentation using deep learning. However, the inherent resolution
discrepancy of CBCT and the loss of occlusal and dentition information largely
limited its clinical applicability. Here, we present a Deep Dental Multimodal
Analysis (DDMA) framework consisting of a CBCT segmentation model, an intraoral
scan (IOS) segmentation model (the most accurate digital dental model), and a
fusion model to generate 3D fused crown-root-bone structures with high fidelity
and accurate occlusal and dentition information. Our model was trained with a
large-scale dataset with 503 CBCT and 28,559 IOS meshes manually annotated by
experienced human experts. For CBCT segmentation, we use a five-fold cross
validation test, each with 50 CBCT, and our model achieves an average Dice
coefficient and IoU of 93.99% and 88.68%, respectively, significantly
outperforming the baselines. For IOS segmentations, our model achieves an mIoU
of 93.07% and 95.70% on the maxillary and mandible on a test set of 200 IOS
meshes, which are 1.77% and 3.52% higher than the state-of-art method. Our DDMA
framework takes about 20 to 25 minutes to generate the fused 3D mesh model
following the sequential processing order, compared to over 5 hours by human
experts. Notably, our framework has been incorporated into a software by a
clear aligner manufacturer, and real-world clinical cases demonstrate that our
model can visualize crown-root-bone structures during the entire orthodontic
treatment and can predict risks like dehiscence and fenestration. These
findings demonstrate the potential of multi-modal deep learning to improve the
quality of digital dental models and help dentists make better clinical
decisions.",2022-03-11T07:50:15Z,http://arxiv.org/abs/2203.05784v1,tooth loss
A latent factor model for spatial data with informative missingness,"Brian J. Reich, Dipankar Bandyopadhyay","A large amount of data is typically collected during a periodontal exam.
Analyzing these data poses several challenges. Several types of measurements
are taken at many locations throughout the mouth. These spatially-referenced
data are a mix of binary and continuous responses, making joint modeling
difficult. Also, most patients have missing teeth. Periodontal disease is a
leading cause of tooth loss, so it is likely that the number and location of
missing teeth informs about the patient's periodontal health. In this paper we
develop a multivariate spatial framework for these data which jointly models
the binary and continuous responses as a function of a single latent spatial
process representing general periodontal health. We also use the latent spatial
process to model the location of missing teeth. We show using simulated and
real data that exploiting spatial associations and jointly modeling the
responses and locations of missing teeth mitigates the problems presented by
these data.",2010-10-07T13:37:28Z,http://arxiv.org/abs/1010.1430v1,tooth loss
"Bayesian Nonparametric Policy Search with Application to Periodontal
  Recall Intervals","Qian Guan, Brian J. Reich, Eric B. Laber, Dipankar Bandyopadhyay","Tooth loss from periodontal disease is a major public health burden in the
United States. Standard clinical practice is to recommend a dental visit every
six months; however, this practice is not evidence-based, and poor dental
outcomes and increasing dental insurance premiums indicate room for
improvement. We consider a tailored approach that recommends recall time based
on patient characteristics and medical history to minimize disease progression
without increasing resource expenditures. We formalize this method as a dynamic
treatment regime which comprises a sequence of decisions, one per stage of
intervention, that follow a decision rule which maps current patient
information to a recommendation for their next visit time. The dynamics of
periodontal health, visit frequency, and patient compliance are complex, yet
the estimated optimal regime must be interpretable to domain experts if it is
to be integrated into clinical practice. We combine non-parametric Bayesian
dynamics modeling with policy-search algorithms to estimate the optimal dynamic
treatment regime within an interpretable class of regimes. Both simulation
experiments and application to a rich database of electronic dental records
from the HealthPartners HMO shows that our proposed method leads to better
dental health without increasing the average recommended recall time relative
to competing methods.",2018-10-10T02:32:12Z,http://arxiv.org/abs/1810.04338v1,tooth loss
"Three-dimensional Generative Adversarial Nets for Unsupervised Metal
  Artifact Reduction","Megumi Nakao, Keiho Imanishi, Nobuhiro Ueda, Yuichiro Imai, Tadaaki Kirita, Tetsuya Matsuda","The reduction of metal artifacts in computed tomography (CT) images,
specifically for strong artifacts generated from multiple metal objects, is a
challenging issue in medical imaging research. Although there have been some
studies on supervised metal artifact reduction through the learning of
synthesized artifacts, it is difficult for simulated artifacts to cover the
complexity of the real physical phenomena that may be observed in X-ray
propagation. In this paper, we introduce metal artifact reduction methods based
on an unsupervised volume-to-volume translation learned from clinical CT
images. We construct three-dimensional adversarial nets with a regularized loss
function designed for metal artifacts from multiple dental fillings. The
results of experiments using 915 CT volumes from real patients demonstrate that
the proposed framework has an outstanding capacity to reduce strong artifacts
and to recover underlying missing voxels, while preserving the anatomical
features of soft tissues and tooth structures from the original images.",2019-11-19T05:56:54Z,http://arxiv.org/abs/1911.08105v3,tooth loss
GAN Prior based Null-Space Learning for Consistent Super-Resolution,"Yinhuai Wang, Yujie Hu, Jiwen Yu, Jian Zhang","Consistency and realness have always been the two critical issues of image
super-resolution. While the realness has been dramatically improved with the
use of GAN prior, the state-of-the-art methods still suffer inconsistencies in
local structures and colors (e.g., tooth and eyes). In this paper, we show that
these inconsistencies can be analytically eliminated by learning only the
null-space component while fixing the range-space part. Further, we design a
pooling-based decomposition (PD), a universal range-null space decomposition
for super-resolution tasks, which is concise, fast, and parameter-free. PD can
be easily applied to state-of-the-art GAN Prior based SR methods to eliminate
their inconsistencies, neither compromising the realness nor bringing extra
parameters or computational costs. Besides, our ablation studies reveal that PD
can replace pixel-wise losses for training and achieve better generalization
performance when facing unseen downsamplings or even real-world degradation.
Experiments show that the use of PD refreshes state-of-the-art SR performance
and speeds up the convergence of training up to 2~10 times.",2022-11-24T10:45:15Z,http://arxiv.org/abs/2211.13524v1,tooth loss
"Sub-Doppler spectroscopy of quantum systems through nanophotonic
  spectral translation of electro-optic light","David A. Long, Jordan R. Stone, Yi Sun, Daron Westly, Kartik Srinivasan","An outstanding challenge for deployable quantum technologies is the
availability of high-resolution laser spectroscopy at the specific wavelengths
of ultranarrow transitions in atomic and solid-state quantum systems. Here, we
demonstrate a powerful spectroscopic tool that synergistically combines high
resolution with flexible wavelength access, by showing that nonlinear
nanophotonics can be readily pumped with electro-optic frequency combs to
enable highly coherent spectral translation with essentially no efficiency
loss. Third-order (\c{hi}(3)) optical parametric oscillation in a silicon
nitride microring enables nearly a million optical frequency comb pump teeth to
be translated onto signal and idler beams; while the comb tooth spacing and
bandwidth are adjustable through electro-optic control, the signal and idler
carrier frequencies are widely tuneable through dispersion engineering. We then
demonstrate the application of these devices to quantum systems, by performing
sub-Doppler spectroscopy of the hyperfine transitions of a Cs atomic vapor with
our electro-optically-driven Kerr nonlinear light source. The generality,
robustness, and agility of this approach as well as its compatibility with
photonic integration are expected to lead to its widespread applications in
areas such as quantum sensing, telecommunications, and atomic clocks.",2023-09-27T23:24:53Z,http://arxiv.org/abs/2309.16069v1,tooth loss
"Multivariate and Online Transfer Learning with Uncertainty
  Quantification","Jimmy Hickey, Jonathan P. Williams, Brian J. Reich, Emily C. Hector","Untreated periodontitis causes inflammation within the supporting tissue of
the teeth and can ultimately lead to tooth loss. Modeling periodontal outcomes
is beneficial as they are difficult and time consuming to measure, but
disparities in representation between demographic groups must be considered.
There may not be enough participants to build group specific models and it can
be ineffective, and even dangerous, to apply a model to participants in an
underrepresented group if demographic differences were not considered during
training. We propose an extension to RECaST Bayesian transfer learning
framework. Our method jointly models multivariate outcomes, exhibiting
significant improvement over the previous univariate RECaST method. Further, we
introduce an online approach to model sequential data sets. Negative transfer
is mitigated to ensure that the information shared from the other demographic
groups does not negatively impact the modeling of the underrepresented
participants. The Bayesian framework naturally provides uncertainty
quantification on predictions. Especially important in medical applications,
our method does not share data between domains. We demonstrate the
effectiveness of our method in both predictive performance and uncertainty
quantification on simulated data and on a database of dental records from the
HealthPartners Institute.",2024-11-19T15:14:13Z,http://arxiv.org/abs/2411.12555v1,tooth loss
"Pose-Aware Instance Segmentation Framework from Cone Beam CT Images for
  Tooth Segmentation","Minyoung Chung, Minkyung Lee, Jioh Hong, Sanguk Park, Jusang Lee, Jingyu Lee, Jeongjin Lee, Yeong-Gil Shin","Individual tooth segmentation from cone beam computed tomography (CBCT)
images is an essential prerequisite for an anatomical understanding of
orthodontic structures in several applications, such as tooth reformation
planning and implant guide simulations. However, the presence of severe metal
artifacts in CBCT images hinders the accurate segmentation of each individual
tooth. In this study, we propose a neural network for pixel-wise labeling to
exploit an instance segmentation framework that is robust to metal artifacts.
Our method comprises of three steps: 1) image cropping and realignment by pose
regressions, 2) metal-robust individual tooth detection, and 3) segmentation.
We first extract the alignment information of the patient by pose regression
neural networks to attain a volume-of-interest (VOI) region and realign the
input image, which reduces the inter-overlapping area between tooth bounding
boxes. Then, individual tooth regions are localized within a VOI realigned
image using a convolutional detector. We improved the accuracy of the detector
by employing non-maximum suppression and multiclass classification metrics in
the region proposal network. Finally, we apply a convolutional neural network
(CNN) to perform individual tooth segmentation by converting the pixel-wise
labeling task to a distance regression task. Metal-intensive image augmentation
is also employed for a robust segmentation of metal artifacts. The result shows
that our proposed method outperforms other state-of-the-art methods, especially
for teeth with metal artifacts. The primary significance of the proposed method
is two-fold: 1) an introduction of pose-aware VOI realignment followed by a
robust tooth detection and 2) a metal-robust CNN framework for accurate tooth
segmentation.",2020-02-06T07:57:34Z,http://arxiv.org/abs/2002.02143v1,tooth loss
Semi-supervised segmentation of tooth from 3D Scanned Dental Arches,"Ammar Alsheghri, Farnoosh Ghadiri, Ying Zhang, Olivier Lessard, Julia Keren, Farida Cheriet, Francois Guibault","Teeth segmentation is an important topic in dental restorations that is
essential for crown generation, diagnosis, and treatment planning. In the
dental field, the variability of input data is high and there are no publicly
available 3D dental arch datasets. Although there has been improvement in the
field provided by recent deep learning architectures on 3D data, there still
exists some problems such as properly identifying missing teeth in an arch. We
propose to use spectral clustering as a self-supervisory signal to joint-train
neural networks for segmentation of 3D arches. Our approach is motivated by the
observation that K-means clustering provides cues to capture margin lines
related to human perception. The main idea is to automatically generate
training data by decomposing unlabeled 3D arches into segments relying solely
on geometric information. The network is then trained using a joint loss that
combines a supervised loss of annotated input and a self-supervised loss of
non-labeled input. Our collected data has a variety of arches including arches
with missing teeth. Our experimental results show improvement over the fully
supervised state-of-the-art MeshSegNet when using semi-supervised learning.
Finally, we contribute code and a dataset.",2022-08-10T19:56:47Z,http://arxiv.org/abs/2208.05539v1,tooth loss
"A new giant species of placented worm and the mechanism by which
  onychophorans weave their nets (Onychophora: Peripatidae)","Bernal Morera-Brenes, Julián Monge-Nájera","Onychophorans, or velvet worms, are poorly known and rare animals. Here we
report the discovery of a new species that is also the largest onychophoran
found so far, a 22cm long female from the Caribbean coastal forest of Costa
Rica. Specimens were examined with Scanning Electron Microscopy; Peripatus
solorzanoi sp. nov., is diagnosed as follows: primary papillae convex and
conical with rounded bases, with more than 18 scale ranks. Apical section
large, spherical, with a basal diameter of at least 20 ranks. Apical piece with
6-7 scale ranks. Outer blade 1 principal tooth, 1 accessory tooth, 1 vestigial
accessory tooth (formula: 1/1/1); inner blade 1 principal tooth, 1 accessory
tooth, 1 rudimentary accessory tooth, 9 to 10 denticles (formula: 1/1/1/9-10).
Accessory tooth blunt in both blades. Four pads in the fourth and fifth
oncopods; 4th. pad arched. The previously unknown mechanism by which
onychophorans weave their adhesive is simple: muscular action produces a
swinging movement of the adhesive-spelling organs; as a result, the streams
cross in mid air, weaving the net. Like all onychophorans, P. solorzanoi is a
rare species: active protection of the habitat of the largest onychophoran ever
described, is considered urgent.",2015-11-03T16:58:53Z,http://arxiv.org/abs/1511.00983v1,tooth loss
"American Twitter Users Revealed Social Determinants-related Oral Health
  Disparities amid the COVID-19 Pandemic","Yangxin Fan, Hanjia Lyu, Jin Xiao, Jiebo Luo","Objectives: To assess self-reported population oral health conditions amid
COVID-19 pandemic using user reports on Twitter. Method and Material: We
collected oral health-related tweets during the COVID-19 pandemic from 9,104
Twitter users across 26 states (with sufficient samples) in the United States
between November 12, 2020 and June 14, 2021. We inferred user demographics by
leveraging the visual information from the user profile images. Other
characteristics including income, population density, poverty rate, health
insurance coverage rate, community water fluoridation rate, and relative change
in the number of daily confirmed COVID-19 cases were acquired or inferred based
on retrieved information from user profiles. We performed logistic regression
to examine whether discussions vary across user characteristics. Results:
Overall, 26.70% of the Twitter users discuss wisdom tooth pain/jaw hurt, 23.86%
tweet about dental service/cavity, 18.97% discuss chipped tooth/tooth break,
16.23% talk about dental pain, and the rest are about tooth decay/gum bleeding.
Women and younger adults (19-29) are more likely to talk about oral health
problems. Health insurance coverage rate is the most significant predictor in
logistic regression for topic prediction. Conclusion: Tweets inform social
disparities in oral health during the pandemic. For instance, people from
counties at a higher risk of COVID-19 talk more about tooth decay/gum bleeding
and chipped tooth/tooth break. Older adults, who are vulnerable to COVID-19,
are more likely to discuss dental pain. Topics of interest vary across user
characteristics. Through the lens of social media, our findings may provide
insights for oral health practitioners and policy makers.",2021-09-16T01:10:06Z,http://arxiv.org/abs/2109.07652v2,tooth loss
